Song	Artist	Lyrics
Movin' on without you	浜崎あゆみ	"Nothing's gonna stop me\Only you can stop me\In the dead of night at 3am\My PHS is by my pillow\I'm waiting for it to ring\Like an idiot, right?\The clock bell sounds\Even if I found\Glass slippers like in a fairy-tale\It'd be no good\If caring for me is a bother\Then tell me quickly\Because even I\Don't have that much free time\I'm movin' on without you\I can't pretend\Like I don't know\About your stupid alibis anymore\Though it's not all\Memories like those for us\I didn't expect it to be so painful\But why is it?\I wonder if it's still too soon\To act like a good girl\Nothing's gonna stop me\Only you can stop me\The lines I've prepared to say\Are perfect\But you still haven't called\It's 4 in the morning\On the too quiet nights\My thoughts run wild\I understand\But I'm not getting enough sleep\I've already forgotten\Those promises\I'll return the ring\So give me back my heart\I have to go without you\It's hard, so\I'll break up with you\Acting like a good girl\Isn't easy\I didn't expect it to be so painful\But why is it?\I wonder if it's still too soon\To act like a good girl\Nothing's gonna stop me\Only you can stop me\It's all right to be confused\I want you to love me\And even though I don't say that\I want you to understand\I didn't expect it to be so painful\But why is it?\I wonder if it's still too soon\To act like a good girl\Nothing's gonna stop me\Only you can stop me"
Cool	Gwen Stefani	"It's hard to remember how it felt before\Now I found the love of my life\Passes things, get more comfortable\Everything is going right\\And after all the obstacles\It's good to see you now with someone else\And it's such a miracle that you and me are still good friends\After all that we've been through\I know we're cool\I know we're cool\\We used to think it was impossible\Now you call me by my new last name\Memories seem like so long ago\Time always kills the pain\\Remember Harbor Boulevard\The dreaming days where the mess was made\Look how all the kids have grown\We have changed but we're still the same\After all that we've been through\I know we're cool\I know we're cool\Yeah, I know we're cool\\And I'll be happy for you\If you can be happy for me\Circles and triangles\And now we're hanging out with your new girlfriend\So far from where we've been\I know we're cool\I know we're cool\\Cool, yeah I know we're cool\I know we're cool\Cool, yeah I know we're cool"
Lil Watan	Mashrou' Leila	"Others tamed hurricanes to control fate\and we fly away from a breeze\and if you dare ask a question about the deterioration of conditions\they shut you up with some slogans about all the conspiracies\the flock calls you a traitor whenever you want to alter your home\they despaired you so you sell your freedom when home is lost\you need to cheer up, come dance with me a bit\why are you frowning, come dance with me a bit\ \They taught you the anthem because loyalty is good for home\they drugged you in the vein and taught you the anther for home\you need to cheer up, come dance with me a bit\why are you frowning, come dance with me a bit"
Goodbye Happiness	宇多田ヒカル	"After the sweet candy's disappeared\there was a lonely boy\and a cloudless summer day\Arms and legs sunburnt, a white dress\I don't care if it gets dirtied\This is an unconscious paradise\At the end of the dream, there's no waiting\One day I learned your name\So goodbye loneliness\Humming a love song\I'm laughing as I reflect in your eyes\So goodbye happiness\I can no longer go back to that time\when I played knowing nothing\But that's fine. Love me\You mustn't think too much and despair\This transient world is child's play\When people become alone\they realize the meaning of love\Departed days\Let me hear a gentle song\Do you still remember the feelings of when we met?\So goodbye innocence\I can no longer go back to that time\when I played knowing nothing\It's your fault. Kiss me\Oh, all things turn and turn\Oh, darling, darling\I won't fall for someone else\Only you\It'd be nice if we could live the way we are\But at important moments, the other me gets in the way\So goodbye happiness\I want to go back to that time\when I played knowing nothing, baby\And then once again kiss me"
Josephine	Yeng Constantino	""
This Is How I Disappear	My Chemical Romance	"Go!\\To un-explain the unforgivable\Drain all the blood and give the kids a show\By streetlight this dark night\A séance down below\There's things that I have done\You never should ever know\\And without you is how I disappear\And live my life alone forever now\And without you is how I disappear\And live my life alone forever now\\Who walks among the famous living dead\Drowns all the boys and girls inside your bed\And if you could talk to me\Tell me if it's so\That all the good girls go to heaven\Well, heaven knows\\That without you is how I disappear\And live my life alone forever now\And without you is how I disappear\And live my life alone forever now\\Can you hear me cry out to you?\Words I thought I'd choke on, figure out\I'm really not so with you anymore\I'm just a ghost\So I can't hurt you anymore\So I can't hurt you anymore\\And now, you wanna see how far down I can sink?\Let me go, fuck!\So you can\Well, now, so you can\I'm so far away from you\Well, now, so you can\\And without you is how I disappear\And without you is how I disappear\Forever, forever now"
Red Sky	Thrice	"I know what lies beneath\I've seen the flash of teeth\Conspiring with the reef\To sink our ship\The wind's a cheating wife\Her tongue a thirsty knife\And she could take your life\With one good kiss\\Can you see the sky turn red\As morning's light breaks over me?\Know tonight we'll make our bed\At the bottom of the sea\\I know the ocean speaks\I've heard her call to me\And smiling in my dreams\She whispers this:\("The stars retreat behind their veil\The clouds are clinging to your sail\The storm is coming, can you see?")\\Can you see the sky turn red\As morning's light breaks over me?\Know tonight we'll make our bed\At the bottom of the sea\\Look and see the sky turn red\Like blood it covers over me\And soon the sea shall give up her dead\We'll raise an empire from the bottom of the sea"
마지막 인사	Bigbang	"Yes! Big Bang is back!\Most definitely, incredible! Hey move!\B to the I to the G Bang Bang\B to the I to the G Bang Bang\B to the I to the G Bang Bang\About love\I don't wanna be without you girl\Got me slowly dying\Where did we go wrong my girl\Why can't we keep on trying\I don't wanna be without you girl\I gave my heart to you\Going outta my mind, cause I love you, I need you girl\Baby baby baby\You know we go back for so long\Baby baby baby\Used to having you here in my arms\Baby baby baby\You know what we had was oh so strong\Just say you'll still be mine\Cause I love you, I need you girl\My homey lover free together yeah we had it all\Could never see you, and you just left forever deep with love\We had a good run\Do everything so happily, so free\And nothing anyone could ever had done\Yeah yeah yeah\Baby you're my everything, I'll do anything for you\Never knew another girl like quite like you\And I wanna excite you\Like, like giving you what you wanna do girl\If there's anyone, I'll straight run 'em\Unafraid of all, GD stun 'em\What up, what up, can't put up, put up\When you're telling me you're gonna need time alone\I don't wanna be without you girl\Got me slowly dying\Where did we go wrong my girl\Why can't we keep on trying\I don't wanna be without you girl\I gave my heart to you\Going outta my mind, cause I love you, I need you girl\Baby baby baby\You know we go back for so long\Baby baby baby\Used to having you here in my arms\Baby baby baby\You know what we had was oh so strong\Just say you'll still be mine\Cause I love you, I need you girl\Tried to call you a thousand times up on the phone\I called you on the phone\Never did you answer once, you know that's wrong\You know that's really wrong yeah\Can we doubt this, I don't wanna know why did you leave me hanging\oh so damn right\Don't you see me praying, don't leave me alone\About love\Yo, it's the rerun, lovers from the front no doubt\Fosho, we got each other's back, that's fact yo\Never had a big problem before\Baby doll, one look at you was all that I saw\assuming we let our love hang all out\With everything we worked out\But little did I know\That you were just over there\I don't wanna be without you girl\Got me slowly dying\Where did we go wrong my girl\Why can't we keep on trying\I don't wanna be without you girl\I gave my heart to you\Going outta my mind, cause I love you, I need you girl\Baby baby baby\You know we go back for so long\Baby baby baby\Used to having you here in my arms\Baby baby baby\You know what we had was oh so strong\Just say you'll still be mine\Cause I love you, I need you girl\How could I've known\Cause all in my eyes\It was all good\Had everything we ever wanted\Now that you're showing your\True colors baby, now I know, you know\Oh, that we weren't meant to be no, no\I don't wanna be without you girl\Got me slowly dying\hey, hey\Where did we go wrong my girl\Why can't we keep on trying\I don't wanna be without you girl\I gave my heart to you\I wanna be your man\Going outta my mind, cause I love you, I need you girl\Baby baby baby\You know we go back for so long\Baby baby baby\Used to having you here in my arms\Baby baby baby\You know what we had was oh so strong\Just say you'll still be mine\Cause I love you, I need you girl\B to the I to the G Bang Bang\B to the I to the G Bang Bang\B to the I to the G Bang Bang\Come on come on come on come on\B to the I to the G Bang Bang\B to the I to the G Bang Bang\Just say you'll still be mine\Cause I love you, I need you girl\About love"
Bored Rigid	COMEBACK MY DAUGHTERS	"the long rain is gone and summer has come i start to remember and winter comes again soon we spend the time separately this year no one knows that we never get back when i was a teenager i started a band and skating what was the difference between you and me? when i was a teenager all the things were easy to start and come to an end what was the difference between you and me? when i was a teenager i was ashamed of being ignorant what was the difference between you and me?"
Genei no Kusari	Screw	"I'm drowning in the deep darkness\Though the night damages me again to my heart\I'm getting buried in a lie that's mocking reality\Though the night kills me again to my heart\My wishes, not learning any lessons from just living\Even if I escape, I don't think I can get rid of it\The bonds control my memories\Why can't I take this life,\Which I should be able to get rid of in one second?\The blood of you, tightly fastened,\Violates me constantly, again and again\In the time of February when I felt a touch of spring\In a chilly night in which the pale plum trees are blooming\I'm wishing for myself\Criticising, so that I won't trust you with my body,\Which is dirty and unable to love\I want to destroy my heart that can't forget you,\I can't destroy it\- karma -\The blood of you, tightly fastened,\Violates me constantly, again and again\In the time of February when I felt a touch of spring\In a chilly night in which the pale plum trees are blooming\Softly, inside of your gentle, warm arms\Erase me\"
Blurry Eyes	L'Arc~en~Ciel	"The wind that comes from the faraway blows at you\Even if I repeat the words that cannot be brought across\You gaze still looked faraway and float out from the window\The same premonition (prediction) continues\Those days are stormy and dark...\Like the bird in a cage with emptiness in the eyes\The afternoon sun\Made you confused like the light out of this world\The same premonition (prediction) continues\Those days are stormy and dark...\The always-changing season robbed the restrictions of each other\Even I reached out my both hands\There is no way to bring back the heart that is had left me\Why do you stare at the sky\With your blurry eyes?\The always-changing season robbed the restrictions of each other\Even I reached out my both hands\There is no way to bring back the heart that had left me\In the always-changing season\The most important person is not here any more\Eyes that are looking back (to the past) carry a soft sigh\...heart had left me long ago..."
MUTE	ESTi x TAK feat. Sanch	
相愛後動物感傷	張惠妹	"A grieved cat licking his after-fight-wound beside the window\A crumpled white mattress made a mess which can't be explained\Whose cigarette butts? Keep behaving arrogantly, spreading the greedy which can't be controlled\Who is holding the umbrella? A bit of heat(warm), it's heaven or misery?\At the peak of the edge, the time always gone tardily than the clock (real-time)\Once the sweat been dried by the wind, covering the skin with the invisible sorrow\Whose relationship, can't be announced? who is acting brave in unfamiliar room.\ Who afraid of rotting in the night? Let the breaths become brutally\Let's fall in love\Occupying the shoulder to block the regrets\Let's fall in love\Chewing a pair of wing and get through another season of darkness.\Let's fall in love\Animals always acting like this, once they are not satisfy\Let's fall in love\(Let's being in love first)\Feel the blues afterward, think about solution afterward."
E Is For Estranged	Owen Pallett	"I think that 80% of a good show is rooted in humiliation\\Boys run like water from the barrel to the trough\They'll never stop their running\Gunning for their brothers\This house is a hostel\It is peaceful, but it's always emptying\Boys all want to be someone\\Haven't you heard? I am a flightless bird\I am a liar, feeding facts to a false fire\If pathos is borne, borne out of bullshit\In formal attire, I'll score you a string ensemble\\I saw my son at seventeen\The shutters made projections on his naked frame\And now at twenty-five\He simply cannot stay away from the ketamine\With makeup on his sores\He spends an hour a day composing little eulogies\Sometimes he sends me letters\But they're mostly garbled phrases and apologies\\But haven't you heard? I am a flightless bird\I am a liar, feeding facts to a false fire\If pathos is borne, borne out of bullshit\In formal attire, cue the Bulgarian men's choir"
Alone in the dark	COMEBACK MY DAUGHTERS	"Somebody, get me out of here\Somebody, take me away\We are still clinging to the dreams of our youth\It's always people like them swimming\at the blackened beach\with half canned and cold\I still remember that scene even now days\Somehow my heart felt lighter\There is someone who make no progress\My dream is still just a dream\Your smile left an impression\Have you ever felt like you are alone in the dark?"
Emily	Joanna Newsom	"The meadowlark and the chim-choo-ree and the sparrow\Set to the sky in a flying spree, for the sport of the pharaoh\Little while later the Pharisees dragged a comb through the meadow\Do you remember what they called up to you and me, in our window?\There is a rusty light on the pines tonight\Sun pouring wine, lord, or marrow\Down into the bones of the birches\And the spires of the churches\Jutting out from the shadows\The yoke, and the axe, and the old smokestacks and the bale and the barrow\And everything sloped like it was dragged from a rope\In the mouth of the south below\We've seen those mountains kneeling, felten and grey\We thought our very hearts would up and melt away\From that snow in the nighttime\Just going\And going\And the stirring of wind chimes\In the morning\In the morning\Helps me find my way back in\From the place where I have been\And, Emily - I saw you last night by the river\I dreamed you were skipping little stones across the surface of the water\Frowning at the angle where they were lost, and slipped under forever\In a mud-cloud, mica-spangled, like the sky'd been breathing on a mirror\Anyhow - I sat by your side, by the water\You taught me the names of the stars overhead that I wrote down in my ledger\Though all I knew of the rote universe were those Pleiades loosed in December\I promised you I'd set them to verse so I'd always remember\\That the meteorite is a source of the light\And the meteor's just what we see\And the meteoroid is a stone that's devoid of the fire that propelled it to thee\And the meteorite’s just what causes the light\And the meteor’s how it’s perceived\And the meteoroid’s a bone thrown from the void\That lies quiet and offering to thee\\You came and lay a cold compress upon the mess I'm in\Threw the window wide and cried, "Amen! Amen! Amen!"\The whole world stopped to hear you hollering\You looked down and saw now what was happening\The lines are fading in my kingdom\(Though I have never known the way to border them in)\So the muddy mouths of baboons and sows and the grouse and the horse and the hen\Grope at the gate of the looming lake that was once a tidy pen\And the mail is late and the great estates are not lit from within\The talk in town's becoming downright sickening\In due time we will see the far buttes lit by a flare\I've seen your bravery, and I will follow you there\And row through the nighttime\Gone healthy\Gone healthy all of a sudden\In search of the midwife\Who could help me\Who could help me\Help me find my way back in\There are worries where I've been\Say, say, say in the lee of the bay; don't be bothered\Leave your troubles here where the tugboats shear the water from the water\(Flanked by furrows, curling back, like a match held up to a newspaper)\Emily, they'll follow your lead by the letter\And I make this claim, and I'm not ashamed to say I know you better\What they've seen is just a beam of your sun that banishes winter\Let us go! Though we know it's a hopeless endeavor\The ties that bind, they are barbed and spined and hold us close forever\Though there is nothing would help me come to grips with a sky that is gaping and yawning\There is a song I woke with on my lips as you sailed your great ship towards the morning\Come on home, the poppies are all grown knee-deep by now\Blossoms all have fallen, and the pollen ruins the plow\Peonies nod in the breeze and while they wetly bow\With hydrocephalitic listlessness ants mop up-a their brow\And everything with wings is restless, aimless, drunk and dour\The butterflies and birds collide at hot, ungodly hours\And my clay-colored motherlessness rangily reclines\Come on home, now! All my bones are dolorous with vines\Pa pointed out to me, for the hundredth time tonight\The way the ladle leads to a dirt-red bullet of light\Squint skyward and listen\Loving him, we move within his borders\Just asterisms in the stars' set order\We could stand for a century\Staring\With our heads cocked\In the broad daylight at this thing\Joy\Landlocked\In bodies that don't keep\Dumbstruck with the sweetness of being\Until we don't be told\Take this\Eat this\Told"
桜流し	宇多田ヒカル	"Watching flowers just blossomed fall\“Too early, this year” you said,\In disappointment, regret\And you were beautiful\If you could see me now\I wonder what you would think\Me, living without you\Everybody finds love\In the end\If you could hear the newborn’s cry,\Sound and healthy\Ringing in the town you protected\I know you would be so pleased\The footsteps that continue after us\Everybody finds love\In the end\I can’t believe that I’ll never see you again\I haven’t told you anything yet\I haven’t told you anything yet\Watching flowers just blossomed fall\The trees stood by, helpless\However great the fear, I will not look away\If at the end of everything, there is love"
TRAP	Meg	" Don’t lead me on too much\I bet it’s a trap but I’m in love with you\It’s so unfair of you to act so nice, hey\Your trap, I let out a sigh\Wait a minute, baby\Play that music louder, I’m listening\Your voice, oh it’s dangerous\Miss you, fluently, like a cigarette\I’m not in… the license-free category!\On the dance floor, side by side, you and me\The air is thin, DJ spins old tunes\Like a dandy hitman? Oh NO! NO!\Woo Baby swing it, Sing La-la-la\It’s a TRAP, right? C’mon now, a trap\Don’t lead me on too much\I bet it’s a trap but I’m in love with you\It’s so unfair of you to act so nice, hey\Your trap, I let out a sigh\Wait a minute, baby\Be quiet for a second, I still have a secret\Yeah a secret, Keep on trying\Nonchalantly lock, trap, Gimme Gimme a Step\You’re so good at doing those kinda smiles\On the dance floor, side by side, you and me\The air is thin, DJ spins old tunes\Making a daring victory with logic, lock lock lock\Woo Baby escort OK, Sing La-la-la\It’s a TRAP, right? C’mon now, a trap\Don’t lead me on too much\I bet it’s a trap but I’m in love with you\It’s so unfair of you to act so nice, hey\Your trap, I let out a sigh\Don’t lead me on so much\I bet it’s a trap but don’t be so cold\It’s so unfair of you to act so nice, hey\Your trap, I let out a sigh\Don’t lead me on too much\I bet it’s a trap let me hear a step\It’s so unfair of you to act so nice, hey\Your trap, it’ll make my heart race "
House of Balloons / Glass Table Girls	The Weeknd	"Been on another level since you came, no more pain\You look into my eyes, you can't recognize my face\You're in my world now, you can stay, you can stay\But you belong to me, you belong to me\\If it hurts to breathe, open the window\Oh, your mind wants to leave but you can't go\This is a happy house, we're happy here\In a happy house, oh this is fun\\Music got you lost\Nights pass so much quicker than the days did\Same clothes, you ain't ready for your day shift\This place will burn you up\But baby it's okay, them my niggas next door\And they working in the trap, so get naughty if you want\So don't blame it on me that you didn't call your home\So don't blame it on me, girl, cause you wanted to have fun\\If it hurts to breathe, open the window\Oh, your mind wants to leave but you can't go\This is a happy house, we're happy here\In a happy house, oh this is fun\\\Bring the 707 out\Bring the 707 out\Bring the 707 out\Bring the 707 out\Bring the 707 out\Bring the 7\\Two puffs for the lady who be down for that\Whatever, together\Bring your own stash of the greatest, trade it\Roll a dub, burn a dub, cough a dub, taste it\Then watch us chase it\With a handful of pills, no chasers\Jaw clenching on some super-sized papers\And she bad and her head bad\Escaping, her van is a Wonderland\And it's half-past six\Read skies cause time don't exist\But when the stars shine back to the crib\Superstar lines back at the crib\And we can test out the tables\Got some brand new tables\All glass and it's four feet wide\But it's a must to get us ten feet high\She give me sex in a handbag\I get her wetter than a wet nap\And no closed doors\So I listen to her moans echo\"I heard he do drugs now"\You heard wrong, I been on it for a minute\We just never act a fool\That's just how we fuckin' live it\And when we act a fool\It's probably cause we mixed it\Yeah I'm always on that okey dokey\Them white boys know the deal\Ain't no fuckin' phony\Big O know the deal\He the one who showed me\Watch me ride this fucking beat\Like he fuckin' told me\"Is that your girl, what's her fucking story?"\"She kinda bad but she ride it like a fucking pony"\I cut down on her man, be her fuckin' story\Yeah I'm talking 'bout you man, get to know me\Ain't no offense, though, I promise you\If you a real man, dude, you gon' decide the truth\But I'm a nice dude with some nice dreams\And we could turn this to a nightmare: Elm Street\\La la la la la la la la\I'm so gone, so gone\Bring out the glass tables\Bring the 707 out\La la la la la la la la\I'm so gone, so gone\Bring out the glass tables\Bring the 707 out\La la la la la la la la\I'm so gone, so gone\Bring out the glass tables\Bring the 707 out\La la la la la la la la\I'm so gone, so gone\Bring out the glass tables\Bring the 707 out\Bring the 707 out\Bring the 707 out"
When You Were Young	The Killers	"You sit there in your heartache\Waiting on some beautiful boy to\To save you from your old ways\You play forgiveness\Watch it now, here he comes\He doesn't look a thing like Jesus\But he talks like a gentlemen\Like you imagined\When you were young\\Can we climb this mountain? I don't know\Higher now than ever before\I know we can make it if we take it slow\Let's take it easy\Easy now, watch it go\We're burning down the highway skyline\On the back of a hurricane that started turning\When you were young\When you were young\\And sometimes you close your eyes\And see the place where you used to live\When you were young\\\They say the devil's water — it ain't so sweet\You don't have to drink right now\But you can dip your feet\Every once in a little while\\\You sit there in your heartache\Waiting on some beautiful boy to\To save you from your old ways\You play forgiveness\Watch it now, here he comes\He doesn't look a thing like Jesus\But he talks like a gentlemen\Like you imagined\When you were young\(Talks like a gentlemen)\(Like you imagined)\When you were young\\I said he doesn't look a thing like Jesus\He doesn't look a thing like Jesus\But more than you'll ever know"
The Earth Will Shake	Thrice	"We dream of ways to break these iron bars\We dream of black nights without moon or stars\We dream of tunnels and of sleeping guards\We dream of blackouts in the prison yard\Heartbroken, we found (a gleam of hope)\Hearken to the sound, (a whistle blows)\Heaven sent reply, (however small)\Evidence of life (beyond these walls)\Born and bred (in this machine)\Wardens dread (to see us dream)\We hold tight (to legends of)\Real life, (the way it was before)\We dream of jailers throwing down their arms\We dream of open gates and no alarms\Look to the day the Earth will shake\These weathered walls will fall away"
