Song	Artist	Lyrics
Only Skin	Joanna Newsom	"And there was a booming above you\That night black airplanes flew over the sea\And they were lowing and shifting like\Beached whales\Shelled snails\As you strained and you squinted to see\The retreat of their hairless and blind cavalry\You froze in your sand shoal\Prayed for your poor soul;\Sky seemed a bread roll, soaking in a milk-bowl\And when the bread broke —\Fell in bricks of wet smoke —\My sleeping heart woke, and my waking heart spoke\Then there was a silence you took to mean something:\Mean, Run, sing\For alive you will evermore be\And the plague of the greasy black engines a-skulking\Has gone east\While you’re left to explain them to me —\Released\From their hairless and blind cavalry\With your hands in your pockets\Stubbily running\To where I’m unfresh\Undressed and yawning —\Well, what is this craziness?\This crazy talking?\You caught some small death\When you were sleepwalking\It was a dark dream, darlin;\It’s over\The firebreather is beneath the clover\Beneath his breathing there is cold clay, forever:\A toothless hound-dog choking on a feather\But I took my fishing pole (fearing your fever)\Down to the swimming hole, where there grows a bitter herb\That blooms but one day a year, by the riverside —\I’d bring it here:\Apply it gently\To the love you’ve lent me\While the river was twisting and braiding, the bait bobbed\And the string sobbed\As it cut through the hustling breeze\And I watched how the water was kneading so neatly\Gone treacly\Nearly slowed to a stop in this heat;\Frenzy coiling flush along the muscles beneath\Press on me\We are restless things\Webs of seaweed are swaddling\You call upon the dusk of the\Musk of a squid:\Shot full of ink, until you sink into your crib\Rowing along, among the reeds, among the rushes\I heard your song, before my heart had time to hush it!\Smell of a stonefruit being cut and being opened\Smell of a low and of a lazy cinder smoking\And when the fire moves away\Fire moves away, son\Why would you say\I was the last one?\Scrape your knee: it is only skin\Makes the sound of violins\When I cut your hair, and leave the birds all the trimmings\I am the happiest woman among all women\And the shallow water stretches as far as I can see\Knee deep, trudging along —\The seagull weeps ‘so long’ —\I’m humming a threshing song —\Until the night is over, hold on\Hold on;\Hold your horses back from the fickle dawn\I have got some business out at the edge of town\Candy weighing both of my pockets down\Till I can hardly stay afloat, from the weight of them\(and knowing how the commonfolk condemn\What it is I do, to you, to keep you warm:\Being a woman. Being a woman.)\But always up the mountainside you’re clambering\Groping blindly, hungry for anything;\Picking through your pocket linings —\Well, what is this?\Scrap of sassafras, eh Sisyphus?\I see the blossoms broke and wet after the rain\Little sister, he will be back again\I have washed a thousand spiders down the drain\Spiders’ ghosts hang, soaked and dangling\Silently from all the blooming cherry trees\In tiny nooses, safe from everyone —\Nothing but a nuisance; gone now, dead and done —\Be a woman. Be a woman\Though we felt the spray of the waves\We decided to stay, 'till the tide rose too far\We weren’t afraid, cause we know what you are;\And you know that we know what you are\Awful atoll —\O, incalculable indiscreetness and sorrow!\Bawl bellow:\Sibyl sea-cow, all done up in a bow\Toddle and roll;\Teethe an impalpable bit of leather\While yarrow, heather and hollyhock\Awkwardly molt along the shore\Are you mine?\My heart?\Mine anymore?\Stay with me for awhile\That’s an awfully real gun\I know life will lay you down\As the lightning has lately done\Failing this, failing this\Follow me, my sweetest friend\To see what you anointed\In pointing your gun there\Lay it down! Nice and slow!\There is nowhere to go\Save up;\Up where the light, undiluted, is\Weaving, in a drunk dream\At the sight of my baby, out back:\Back on the patio\Watching the bats bring night in\— while, elsewhere\Estuaries of wax-white\Wend, endlessly, towards seashores unmapped\*\Last week, our picture window\Produced a half-word\Heavy and hollow\Hit by a brown bird\We stood and watched her gape like a rattlesnake\And pant and labor over every intake\I said a sort of prayer for some rare grace\Then thought I ought to take her to a higher place\Said, “dog nor vulture nor cat shall toy with you\And though you die, bird, you will have a fine view.”\Then in my hot hand, she slumped her sick weight\We tramped through the poison oak, heartbroke and inchoate\The dogs were snapping, so you cuffed their collars\While I climbed the tree-house. Then how I hollered!\Cause she’d lain, as still as a stone, in my palm, for a lifetime or two;\Then saw the treetops, cocked her head, and up and flew\(While back in the world that moves, often, according to\The hoarding of these clues\Dogs still run roughly around\Little tufts of finch-down\The cities we passed were a flickering wasteland,\But his hand, in my hand, made them hale and harmless\While down in the lowlands, the crops are all coming;\We have everything\Life is thundering blissful towards death\In a stampede\Of his fumbling green gentleness\You stopped by;\I was all alive\In my doorway, we shucked and jived\And when you wept, I was gone;\See, I got gone when I got wise\But I can’t with certainty say we survived\Then down and down\And down and down\And down and deeper\Stoke, without sound\The blameless flames\You endless sleeper\Through fire below\And fire above\And fire within\Sleep through the things that couldn’t have been\If you hadn’t have been\And when the fire moves away\Fire moves away, son\Why would you say\I was the last one?\All my bones, they are gone, gone, gone\Take my bones, I don’t need none\Cold, cold cupboard, lord, nothing to chew on!\Suck all day on a cherry stone\Dig a little hole not three inches round —\Spit your pit in a hole in the ground\Weep upon the spot for the starving of me!\Till up grows a fine young cherry tree\When the bough breaks, what’ll you make for me?\A little willow cabin to rest on your knee\What’ll I do with a trinket such as this?\Think of your woman, who’s gone to the west\But I’m starving and freezing in my measly old bed!\Then I’ll crawl across the salt flats, to stroke your sweet head\Come across the desert with no shoes on!\I love you truly\Or I love no-one\Fire moves away. Fire moves away, son\Why would you say that I was the last one, last one?\Clear the room! There’s a fire, a fire, a fire\Get going\And I’m going to be right behind you\And if the love of a woman or two, dear\Couldn't move you to such heights\Then all I can do\Is do, my darling, right by you"
Ghosts	Ibeyi	"Welcome to my earth\It's a crying shame\We have built a foolish world\Busy fighting, cruelly lying and denying\\My ghosts are not gone\They dance in the shade\And kiss the black core of my heart\Making words, making sounds, making songs\\Now you can feel my heart spinning\You turn my whole life around\I want to write a new beginning\Let go of the ghosts\Let dreams and hopes fly\And give our love another try\Should we just let it be?\\Make love to me\My ghosts are not gone\They kiss the black core of my heart\Making words making sounds making songs\\Now you can feel my heart spinning\You turn my whole life around\I want to write a new beginning\Let go of the ghosts\Let dreams and hopes fly\And give our love another try\Should we just let it be?\\We ain't nothing without love, without love\We ain't nothing without love, without love\\Mai mai mai soronso ae\Aggayu soronso\Mai mai mai soronso ae\Aggayu soronso\Mai mai mai soronso ae\Aggayu soronso\Mai mai mai soronso ae\Mai mai mai soronso ae\Mai mai mai soronso ae"
Gold (feat. Casey Lee Williams)	Jeff Williams	"Jeff Williams","Dream of anything;\I'll make it all come true\Everything you need\Is all I'll have for you\I'm forever\Always by your side\Whenever you need a friend\I'm never far behind\If the stars all fall\When there's no more light\And the moon should crumble\It will be alright\Don't you worry about the dark\I will light up the night with the love in my heart\I will burn like the sun\I will keep you safe and warm\Like the smell of a rose on a summer's day\I will be there to take all your fears away\With a touch of my hand\I will turn your life to gold\With a touch of my hand\I'll turn your life to gold\Let's have everything\Nothing we cannot do\Every heart just beaming\Every sky turns blue\I'm so happy\Just to have you here\Smiles bringing sunshine\And worries disappear\When the days turn dark\And we start to fall\I will pick you up and\We will fix it all\Don't you worry about the dark\I will light up the night with the love in my heart\I will burn like the sun\I will keep you safe and warm\Like the smell of a rose on a summer's day\I will be there to take all your fears away\With a touch of my hand\I will turn your life to gold\Gold...\Don't worry, I've got you;\Nothing will ever harm you\I'm close by, I'll stay here;\Through all things, I will be near\Close your eyes\Don't you cry\Love's around you;\In time, you'll fly\Don't you worry about the dark\I will light up the night with the love in my heart\I will burn like the sun\I will keep you safe and warm\Like the smell of a rose on a summer's day\I will be there to take all your fears away\With a touch of my hand\I will turn your life to gold\With a touch of my hand\I'll turn your life to gold"
渦中の男	椎名林檎	"And when the evening comes\a young girl is crying some\I know you don’t think it so\wrong or impolite\To say it more than twice,\repeat it every night\I know it must to you\seem something I should know\It may or may not come\It hasn’t happened but\You talk and don’t let go\The world is moving slow\You say it more than twice,\repeat it every night\I know it must to you\seem something I should know\I don’t, don’t want to know\So so loud, so I\say, oh and oh,\that’s enough for me\If you would chase a fly\don’t look at some girl’s life\don’t swat beyond your eyes\Just turn and face your own\And you may find it flew\Into another room\So go and chase it down\And find yourself a home\They say to speak your mind\or else get passed in line\I think it must to you\seem something I should say\I won’t, won’t say a word\Everything is\none of my concern\Absolutely\none of my concern\Relative to you\I’m hearing clear\what is true\Trying in vain to say something\wastes a lifetime; it’s halfway to noise\Beautiful things must be something—\They are the things that never can lie\Here in my heart, the answer is clear\It’s always clear, and here I can fly\Beautiful things must be something—\They are the things that never can lie\I don’t, don’t want to know\None of my concern\So oh and oh-oh, silently"
Vanitas	DIR EN GREY	"Even the scar that's needed to survive grabs\Hold of the lightly-colored spring and stops\Staring into the night, wanting to escape as the voice trembles\Why does death come?\Hearing that word before somewhere\The same answer rains down mischievously\Goodbye to you\The eyes won't look back\To have loved passionately\Listening closely to hear the murmur\I was hiding the end in the dream unconquered\Hoping that this day will be a wonderful day\If you would just...\The ant lion searching for the light\The lost heart always looks to the future as the flowers of lycoris sway\Goodbye to you\The eyes won't look back\To have loved passionately\Listening closely to hear the murmur\I was hiding the end in the dream unconquered\Hoping that this day will be a wonderful day\I will again wipe the tears that will come running down tomorrow\Not stopping, for we will meet at the destination\For One More Day\Words won't teach you anymore, now that you are Alice\here?"
I Can Change	Brandon Flowers	"When your time runs out and you're looking for a place to land\I'll step from the shadow, into the palm of your hand\When you're out of luck, I'll be what you're looking for\Even if it's not who I am\When you're out of luck, I'll be what you're looking for\Even if it's not who I am\\I can change, I can change for you\I can change, I can change for you\\I can bend, I can break, I can shift, I can shake\Blaze a trail through the driving rain\Girl I can change for you, I can change for you\Woo ooh, Woo ooh\Woo ooh, Woo ooh\\When your time runs out, and you don't where to stand\I'll step from the shadow, I'm at your command\And when you're looking for change\I'll be what you're looking for\Even if it's not who I am\\I can change, I can change for you\I can change, I can change for you\\I can bend, I can break, I can shift, I can shake\Blaze a trail through the driving rain\Girl I can change for you\I can slip, I can slide, I can run, I can hide\Blaze a trail through the driving rain\Girl I can change for you\\I'll be what you're looking for\I'll be what you're looking for\\I can change, I can change for you\I can change, I can change for you\\Woo ooh, I can change, Woo ooh\Oh-wooh, I can change, oh-wooh\I can bend, I can break, I can shift, I can shake\Place the trail through the drive of rain\I can slip, I can slide, I can run, I can hide\Place the trail through the drive of rain\Girl I can change for you\I can change for you\I can change\I'll be what you're looking for\Oh-wooh, oh-wooh, oh-wooh"
DEATH	::M∆DE::IN::HEIGHTS::	"Feel it rush like a hush in the attic, bae\You could see me blush when I tell you all about it\In a moment hit the switch, then a moment in the dark\Then a moment so pervasive it was breaking us apart\The galaxy is spreading like a rumor in your jaw\Better keep your planet spinning better keep the motive tall\There’s time inside my tears making diamonds on the wall\Heavy forest summer night, I confess that I'm a lightweight\Cause fate is rolling up and hate is blowing up\If it’s a crime to bend the line then we should tear it up\And when the waters start to cross, I'll call you up\I genuinely love to hear your thoughts\Inherited these ways and they came with seven claws\Like the terror that remains every morning in the dark\And the tethers that you lace only tie you in a knot\Don’t fall for all the blame, don’t rely on the applause\Tripping for so long, I've been tripping for so long\Tripping for so long, I've been tripping for so long\Your burden was the weight of a feather\I was certain if I waited you’d remember\When the comet took me out into space\When you held your breath, looking at my face\Now I comprehend that death is not the end\And the world that we destroyed wasn't real enough to live in\But I’m alive, yes I'm alive\I can feel it running up and down my spine\ (x2)\Tripping for so long, I've been tripping for so long\Tripping for so long, I've been tripping for so long\Tripping for so long, I've been tripping for so long\Tripping for so long, I've been tripping for so long"
Dare I Care	Julian Casablancas + The Voidz	" Hit the knee – ow – heck, they’re ready\S.O.N.’s SAT, how magenta are you?\Daddy, I owe Doc Luke a Mercedes\Barely up and I’m looking for jobs.\Yup, they been at your house already\Who, me? Sad? I’m last to hear\Yeah, they been at your house already\Who me? Fuck, I’m last to hear.\What a real woman won’t mind\But don’t be weird with me\I won’t be weird with you\But I wanna be weird my way\It won’t be my way\American always our way\What can I say?\In the band I put the key, cause I did my time\What can I say?\Your memory’s no good, leave your clothes on\Our bodies crave a lot of things that end in loss\Don’t try and turn this into something else,\Too late to change your mind this time and hit eject\Now that I’m here\I been wasting half my life\Right here is where my friends they used to live\Hit the knee – ow – heck, they’re ready\S.O.N.’s SAT, how magenta are you?\Daddy, I owe Doc Luke a Mercedes\Barely up and I’m looking for jobs.\Who, me? Sad? I’m last to hear\Yeah, they been at your house already. Who the fuck?\I want my money back\That wasn’t fun.\The bricks and the gravel and the mud and the blood\Another wild teenager in search of success, welcome to the jewel of the modified west\Now that I’m here, o-o-oh\I’ve been wasting half my life\Right here is where my friends they used to live…\–\I don’t care anymore\I’d don’t dare anymore.\Now that I’m here, where my friends they used to live\I don’t care anymore, I’d dare anymore\That’s how they know, that’s how they know,\Calm down\That’s what they say, that’s how they know "
Trying Your Luck	The Strokes	"You said you couldn't stay\You've seen it all before, I know\And sold you on their way\Oh, honey, that's okay\\No harm, he's armed, setting off all your alarms\When I find out, I hope it's you who set this trap\\And store fronts rarely change\At least I'm on my own again\Instead of anywhere with you\Oh, tell me it's all the same\\And I've lost my page again\I know this is surreal but I'll try my luck with you\Oh, this life is on my side, oh, I am your one\Believe me this is a chance, oh, oh\\Let's see what is for sale\He's trying not to give his job a chance\Oh, it's never gonna be\It's sad, but I agree\The signals don't seem right\It lasts for just one night and then\I'm sorry that I said\That we were just good friends\\No harm, he's armed, setting off all your alarms\Entranced, I can't be here in time, I'll think about that\\And I've lost my page again\I know this is surreal but I'll try my luck with you\Oh, this life is on my side, well, I am your one\Believe me, oh, this is a chance, oh, oh"
流転の塔	DIR EN GREY	"The vagrant past projects reverberation\The apostle stares into the arrhythmia of reality\The never-ending sunlight is so blinding it's cruel\Holding closely the apple falling from the sensual synapses\Now, I look into your eyes\Holding closely the tears I shed from the sensual empty wish\Now, I shut-out the sound of the rain\Gods Of Rapture\Dear sky\Mind\It sinks to the root of the streaming flag\Tracing the dewfall of the Dead Sea with my finger,\The sternum screams agape\God Complex\Get this\Good Day\Am I The Magnificent Humanitarian\Who Shall Sound The Broken Bell?\Restructuring\A furious uplift\If everyone just learned to keep silent\We'd break open the summit and climb the ivy\In the land of accidental tokarev explosions\And the child of all creation\Aim for the day we turn into mere worms\That are as colorful as they are indecent\Is the kindness of messing up the arrangement called arrogance?\Don't want to forget the vagrant past\Death stares into the arrhythmia of reality\And the never-ending sunlight is so blinding it's cruel\The future screams and you are unable\To turn around and go back\Wake up\Joining hands with the flower that's lost its way\Don't want to forget the vagrant past\Death stares into the arrhythmia of reality\And the never-ending sunlight is so blinding it's cruel\The future screams and you too, are unable\To turn around and go back\Wake up"
I'm Feeling You	Capsule	"baby baby The kisses, they’re a joke\I’m searching for the feeling feeling, with my lips\Satisfied just by you touching me\Yeah, your heartbeat\baby baby That’s right, in the rain\feeling feeling You pretend to look my way\And nod with a look in your eye like you’re crying\Yeah, I feel it\I’m feeling you\I’m feeling you\baby I just wanna feel you\take me high, so I melt with you.\I’m feeling you\I’m feeling you\baby I just wanna feel you\take me high, so I melt with you.\I’m feeling you\baby baby The kisses, they’re a joke\I’m searching for the feeling feeling, with my lips\Satisfied just by you touching me\Yeah, your heartbeat\I’m feeling you\I’m feeling you\baby I just wanna feel you\take me high, so I melt with you.\I’m feeling you\I’m feeling you\baby I just wanna feel you\take me high, so I melt with you.\I’m feeling you\I’m feeling you\I’m feeling you"
Again (Cover)	CollaboDaisakusen	
Addicted To You [UP-IN-HEAVEN MIX]	宇多田ヒカル	"I don't especially need to see you\Besides, there are plenty of things to do\I really don't need to talk to you everyday\My phone bills are piling up\Unchanging love doesn't exist\Besides, you become stronger when you're uneasy\I won't tell anyone about our relationship\I'm not a child\There's no road leading to eternity\And if there was, I wouldn't mind taking another\Laughable talk\And even if I get hurt I'm back for more\I might be addicted to you\Just because I can't see you doesn't mean it's the end of the world\We know each other's situation\But that's so frustrating, I want to see you everyday\What can I do about these feelings?\I want to be an adult right now, but I can't so suddenly\Oh baby, I might be addicted to you\There's no reason to want each other\We need to keep everything in order\When I turn on the answering machine in the middle of night\I hear your message, and want to call you back\I'm in love with you\I know you want me too\I suppose I don't speak it because I can't\Weepy story\Everytime I doubt you, I love you more\I might be addicted to you\Everyone has similar excuses\I think they just need a reason\But that's so frustrating, I want to see you everyday\Can I inform you of these feelings?\More than kissing, I want you to hold me, and don't let go so suddenly\Oh baby, I might be addicted to you\My longing for you on days we can't meet and my love for you when I'm by your side\Have both become equally part of my habits\More than kissing, I want you to hold me, and don't let go so suddenly\Oh baby\But that's so frustrating, I want to see you everyday\What can I do about these feelings?\I want to be an adult right now, but I can't so suddenly\Oh baby, I might be addicted to you\More than kissing, I want you to hold me\And don't let go so suddenly\Oh baby, I think I'm addicted to you"
Stay Gold	宇多田ヒカル	"I love you\So I don't need to worry about anything\My darling Stay gold\Smile innocently for me forever\ \The boy hiding in your eyes\Hasn't stopped tickling my instincts\ \Aa, somehow, just like this Good luck\ \Certainly, there will be many\Sad things from here on\My darling Stay gold\Because even painful things are important\ \I love you\So I don't need to worry about anything\My darling Stay gold\Smile innocently for me forever\ \When job-seraching, always, you don't need to play around\Applying some adult common sense and wisdom is good\ \Aa Just like this for today Good night\ \It can be said the normal feelings\Of a person's heart are something that change\Nee, darling Your soul\Shines on tenderly\ \I love you\So I don't need to worry about anything\My darling Stay gold\Smile innocently for me forever\ \I love you\So I don't need to worry about anything\My darling Stay gold\Just stay smiling innocently Always"
Hurry Xmas	L'Arc~en~Ciel	"The dolled up street is like a fantasy\Even if it's like this all year round, I wouldn't mind\My heart is racing as I hide the present you wanted.\Ah hurry, yeah hurry, Isn't it Christmas Eve yet?\Hurry christmas! I'll steal the night sky and light the candles\Beloved, the stars are in your eyes\Fill the glasses with the bubbling sweetness, so sweet!\Come on, the party is starting\come on music!\I wish there were snow drifts, but it seems this year it won't snow.\With you wearing that nice dress, I'd need nothing else.\Oh, the glittering streets are filled with dreams\Painting over the world!\Hurry christmas! I'll steal the night sky and light the candles\Beloved, the stars are in your eyes\Fill the glasses with the bubbling sweetness, so sweet!\Come on, it's the start of the party\Hurry christmas! I'll steal the night sky and light the candles\I'll keep my present for her hidden for a while\Holly wreath and candy cane decorated tree\I wonder if she would be glad?\christmas time has come to town (christmas time has come to town)\christmas time for you and me (christmas time for you and me)\christmas time has come to town (christmas time has come to town)\A kiss on this blessed night! Thank you Jesus"
COLORS	宇多田ヒカル	"\While I was worrying about the illusions reflected in the mirror\at some point I'd picked up the pace\Having been told you can go anywhere you want,\all the guideposts turned grey under my half-baked desires\The flickering flame\Draws out a dream again tonight\Is the tip of your paintbrush\Drying out?\ \If you can see a blue sky, open a blue umbrella\How about it?\The canvas is yours\Do you fly a white flag only when you've given up?\Beckoned now by pure red\Like a bullfighter\ \Colors faded under a fluorescent bulb\I meet you on a black-and-white chessboard\Wandering, we hold each other close\for a time\But a month later\Will we still remember?\ \Watching an orange sunset by your side\It was good, and yet\The less said the better\Do you wear black only when mourning?\A red lipstick kiss purposely left behind\ \And if you say For me,\there are nothing but dreamless pictures left to draw\Paint the whole canvas over, however many times it takes\Do you fly a white flag only when you've given up?\Now I've become a color that you do not know"
