Song	Artist	Lyrics
Fools	The Ransom Collective	"Oh woah oh oh\Oh woah oh oh\Oh woah woah oh\Oh woah oh oh\Oh woah oh oh\Oh woah woah oh\\Eventually we'll fall asleep and dream about these past 3 weeks\Or lie awake and dedicate our thoughts of finding what it means\But when it is all said and done, I can't think of anyone else\Nothing is just as it seems, at least that's what it seems to me\And everybody has a path, but some will walk reluctantly\Well, you can throw your map away 'cause I'll be here in another day or two\\Hope will take its toll\And ignite your soul\They will follow the flashes in the dark\And they won't stop until they find where to start\\Ohhh...\Ohhh...\Ohhh...\\We were told as we grow old that one day we would find ourselves\But as we aged, everything changed\And we were locked by different spells\Well, love is such an abstract art\And we each have a different part to play\They will find that over time\That they can't help but play along\And as we wait, they hesitate for fear that something may go wrong\When the smoke gas finally clears and things are not just as they appear\\Hope will take its toll\And ignite your soul\They will follow the flashes in the dark\And they won't stop until they find where to start\Hope will take its toll\And ignite your soul\Hope will take its toll\And ignite your soul\Hope will take its toll\And ignite your soul\Hope will take its toll\And ignite your soul\They will follow the flashes in the dark\And they wont stop until they find where to start\Ohhh...\Ohhh...\Ohhh..."
Swim Good	Frank Ocean	"That's a pretty big trunk on my Lincoln town car, ain't it?\Big enough to take these broken hearts and put 'em in it\Now I'm drivin' 'round on the boulevard, trunk bleedin'\And every time the cops pull me over, they don't ever see them\They never see them\\And I've got this black suit on\Roamin' around like I'm ready for a funeral\Five more miles 'til the road runs out\\I'm about to drive in the ocean\I'ma try to swim from somethin' bigger than me\Kick off my shoes and swim good, and swim good\Take off this suit and swim good, and swim good, good\\Got some pretty good beats on this 808 CD, yeah\Memory seats I'm sittin' on stay heated\I woulda put tints on my windows but what's the difference?\If I feel like a Ghost, no Swayze\Ever since I lost my baby\\I've had this black suit on\Roamin' around like I'm ready for a funeral\One more mile 'til the road runs out\\I'm about to drive in the ocean\I'ma try to swim from somethin' bigger than me\Kick off my shoes and swim good, and swim good\Take off this suit and swim good, and swim good, good\\I'm goin' off (Oh, my pretty love)\Don't try stopping me\I'm goin' off (Throw me a line)\Don't try saving (Broke my heart)\No flares (Broke my heart)\No vest (Drove my love)\And no fear\Waves are washin' me out\\I'm about to drive in the ocean\I'ma try to swim from somethin' bigger than me\Kick off my shoes and swim good, and swim good\Take off this suit and swim good, and swim good, good\\Don't die"
It's Oh So Quiet	Björk	"Sssh, sssh\It's, oh, so quiet\Sssh, sssh\It's oh, so still\Sssh, sssh\You're all alone\Sssh, sssh\And so peaceful until\\You fall in love\Zing boom\The sky up above\Zing boom\Is caving in\Wow bam\\You've never been so nuts about a guy\You want to laugh, you wanna cry\You cross your heart and hope to die\\'Til it's over, and then\Sssh, sssh\It's nice and quiet\Sssh, sssh\But soon again\Sssh, sssh\Starts another big riot\\You blow a fuse\Zing boom\The devil cuts loose\Zing boom\So what's the use\Wow bam\Of falling in love?\\It's, oh, so quiet\It's oh, so still\You're all alone\And so peaceful until\\You ring the bell\Bim bam\You shout and you yell\Hi ho ho\You broke the spell\\Gee, this is swell, you almost have a fit\This guy is "gorge" and I got hit\There's no mistake, this is it\\'Til it's over and then\It's nice and quiet\Sssh, sssh\But soon again\Sssh, sssh\Starts another big riot\\You blow a fuse\Zing boom\The devil cuts loose\Zing boom\So what's the use\Wow bam\Of falling in love?\\The sky caves in\The devil cuts loose\You blow, blow, blow, blow, blow your fuse\When you fall in love\Sssh"
I Believe (feat. Kat McDowell)	DAISHI DANCE	
Like Moths To Flame	Thrice	"Once again these bitter herbs\The perfect compliment to all your cryptic words\I nod but don't know what to say\But I know you and I believe you're who you say you are, so\\I, I will follow you, lay down my life\I would die for you, this very night\\Once again the bread and wine\But it seems the meanings may be deeper still this time\And you surprised me when you said I'd fall away\Don't you know me?  I could never be ashamed of you, no\\I, I will follow you, lay down my life\I would die for you, this very night\\I've never been this cold, the fire's gravity compels!\Like planets cling to sol, I feel my orbit start to fail!\Like moths to flame I come, too close and all my oaths are burned!\As stars begin to run, all my accusers take their turn!\And calling curses down, from my lips lies like poison spill!\And then that awful sound, the sound of prophesy fulfilled!\And then I met your eyes, and I remember everything!\And something in me dies, the night that I betrayed my king!"
暁	DIR EN GREY	
1582	KAT-TUN	
Gossip (English Cover)	Ashe	
Blame It On The Girls	Mika	"So, I was sitting there in the bar and this guy came up to me and he said "my life stinks" and I saw his gold credit card and I saw the way that he was looking at people across the room, and I looked at his face and, you know, quite a good looking face, and I just said "dude, your perspective on life sucks"\\He's got looks that books take pages to tell\He's got a face to make you fall on your knees\He's got money in the bank to thank and I guess\You could think he's living at ease\\Like lovers on the open shore -- What's the matter?\When you're sitting there with so much more -- What's the matter?\While you're wondering what the hell to be\Are you wishing you were ugly like me?\\Blame it on the girls who know what to do\Blame it on the boys who keep hitting on you\Blame it on your mother for the things she said\Blame it on your father but you know he's dead\\Blame it on the girls\Blame it on the boys\Blame it on the girls\Blame it on the boys\\Life could be simple but you never fail\To complicate it every single time\You could have children and a wife, the perfect little life\But you blow it on a bottle of wine\\Like a baby you're a stubborn child -- what's the matter?\Always looking for an axe to grind -- what's the matter?\While you're wondering what the hell to do\Were you wishing we were lucky like you?\\Blame it on the girls who know what to do\Blame it on the boys who keep hitting on you\Blame it on your mother for the things she said\Blame it on your father but you know he's dead\\Blame it on the girls\Blame it on the boys\Blame it on the girls\Blame it on the boys\Blame it on the girls\Blame it on the boys\Blame it on the girls\Blame it on the boys\\He's got looks that books take pages to tell\He's got a face to make you fall on your knees\He's got money in the bank to thank and I guess\You could think he's living at ease\\Blame it on the girls who know what to do\Blame it on the boys who keep hitting on you\Blame it on your mother for the things she said\Blame it on your father but you know he's dead\\Blame it on the girls\Blame it on the boys\Blame it on the girls\Blame it on the boys\Blame it on the girls\Blame it on the boys\Blame it on the girls\Blame it on the boys"
Steady, as She Goes	The Raconteurs	"Find yourself a girl and settle down\Live a simple life in a quiet town\\Steady as she goes\(Steady as she goes)\Steady as she goes\(Steady as she goes)\So steady as she goes\\Your friends have shown a kink in the single life\You've had too much to think, now you need a wife\\Steady as she goes\(Steady as she goes)\Steady as she goes\(Steady as she goes)\So steady as she goes\\Well here we go again\You've found yourself a friend that knows you well\But no matter what you do\You'll always feel as though you tripped and fell\So steady as she goes\\When you have completed what you thought you had to do\And your blood's depleted to the point of stable glue\Then you'll get along\Then you'll get along\\Steady as she goes\(Steady as she goes)\Steady as she goes\(Steady as she goes)\So steady as she goes\\Well here we go again\You've found yourself a friend that knows you well\But no matter what you do\You'll always feel as though you tripped and fell\So steady as she goes\So steady as she goes\Steady as she goes\Settle for a world, neither up or down\(Settle for a world, neither up or down)\Sell it to the crowd that has gathered round\(Sell it to the crowd that has gathered round)\Settle for a girl, neither up or down\(Settle for a girl, neither up or down)\Sell it to the crowd that has gathered round\(Sell it to the crowd that has gathered round)\\Steady as she goes\(Steady as she goes)\Steady as she goes\(Steady as she goes)\So steady as she goes\\Steady as she goes\(Steady as she goes)\Steady as she goes\(Steady as she goes)\So steady as she goes\Steady as she goes, are you steady now?\Steady as she goes, are you steady now?\Steady as she goes, are you steady now?\Steady as she goes, are you steady now?\Steady as she goes"
Thinkin Bout You	Frank Ocean	"A tornado flew around my room before you came\Excuse the mess it made, it usually doesn't rain in\Southern California, much like Arizona\My eyes don't shed tears, but boy, they pour when\\I'm thinkin' 'bout you (Ooh no, no, no)\I've been thinkin' bout you (You know, know, know)\I've been thinkin' bout you, do you think about me still?\Do ya, do ya?\\Or do you not think so far ahead?\Cause I been thinkin' bout forever, ooh\Or do you not think so far ahead?\Cause I been thinkin' bout forever, ooh\\No, I don't like you, I just thought you were cool enough to kick it\Got a beach house I could sell you in Idaho\Since you think I don't love you, I just thought you were cute, that's why I kissed you\Got a fighter jet, I don't get to fly it though, I'm lying down\\Thinkin' 'bout you (Ooh no, no, no)\I've been thinkin' bout you (You know, know, know)\I've been thinkin' bout you, do you think about me still?\Do ya, do ya?\\Or do you not think so far ahead?\Cause I been thinkin' bout forever, ooh\Or do you not think so far ahead?\Cause I been thinkin' bout forever, ooh\\Yes, of course, I remember, how could I forget how you feel?\You know you were my first time, a new feel\It won't ever get old, not in my soul, not in my spirit, keep it alive\We'll go down this road 'til it turns from color to black and white\\Or do you not think so far ahead?\Cause I been thinkin' bout forever, ooh\Or do you not think so far ahead?\Cause I been thinkin' bout forever, ooh"
Feel Good Inc.	Gorillaz	"feel good\Sha, sha ba da, sha ba da, Feel Good\City's breaking down on a camel's back\They just have to go, 'cause they don't know wack\So while you fill the streets, it's appealing to see\You won't get undercounted 'cause you're damned and free\You got a new horizon, it's ephemeral style\A melancholy town where we never smile\And all I wanna hear is the message beep\My dreams, they got her kissing, 'cause I don't get sleep, no\*Beep*\\Windmill, windmill for the land\Turn forever hand in hand\Take it all in on your stride\It is ticking, falling down\Love forever, love is free\Let's turn forever, you and me\Windmill, windmill for the land\Is everybody in?\\Laughin' gas these hazmats, fast cats\Linin' 'em up like ass cracks\Play these ponies at the track\It's my chocolate attack\Shit, I'm steppin' in the heart of this here (yeah)\Care Bear rappin' in harder this year (yeah)\Watch me as I gravitate, ha-ha-ha-ha-ha!\Yo, we gon' ghost town this Motown\With yo' sound, you in the blink\Gon' bite the dust, can't fight with us\With yo' sound, you kill the Inc. \So don't stop, get it, get it (Get it)\Until you're cheddar head\And watch the way I navigate, ha-ha-ha-ha-ha\Windmill, windmill for the land\Turn forever hand in hand\Take it all in on your stride\It is ticking, falling down\Love forever, love is free\Let's turn forever, you and me\Windmill, windmill for the land\Is everybody in?\\Don't stop, get it, get it (Sha, sha ba da, sha ba da, Feel Good)\Peep how your captain's in it\Steady, watch me navigate, ha-ha-ha-ha-ha! Sha, sha ba da, sha ba da, feel good"
Keep Tryin'	宇多田ヒカル	
Gravemakers & Gunslingers	Coheed and Cambria	"So draw, little piggy, better watch out for number one\(I fear there's a bad wind blowing through there)\You better put up the shutters, 'cause Lord knows\Now, I ain't stopping 'til the worst gets alive\Little strutter, don't you creep out that fucking rut\(It's best that you don't go walking, through there)\Now please a don't bother knocking\'Cause God knows I ain't now stopping 'til you breathe none\\(Hey!) What I miss?\We're one and the same\Just give it the push while I kick-start\(There's just no time for this)\\Come on! It's just the hurt I'm looking for\I don't wanna live, no more\You've got the gun, I've got the bullets\Don't wanna live, no more\Oh baby, be my lover\Go on and pull that trigger!\\You're the sin of this city, now repent for the wrong you've done\(I'm not sorry for this, not sorry at all)\You're a snake under cover\No room for another, just these bad motherfuckers\Leave a long trail of nothing, little bad boy with gun in hand\(It's best that you don't go walking, through there)\Now, please a-come boy, a-popping\'Cause God knows I ain't now stopping 'til you breathe none\\(Hey!) What I miss?\We're one and the same\Just give it the push while I kick-start\(There's just no time for this)\\Come on! It's just the hurt I'm looking for\I don't wanna live, no more\You've got the gun, I've got the bullets\Don't wanna live, no more\Oh baby, be my lover\Go on and pull that trigger!\\Let flood out the weasel's hole\(Oh, Christ will you bury my body?)\To choke out all the lies it's told\(Oh, Christ will you bury my body?)\With time, hope the hurt gets old\(Oh, Christ will you bury my body?)\Let's fuck out the weasel's hole\(Oh, Christ will you bury my body?)\\We'll keep marching to the top of this tower\As God isn't at home, no\There's nothing in the way that could stop us\It's your time to go\\(Hey!) What I miss?\We're one and the same\Just give it the push while I kick-start\(There's just no time for this)\\Come on! It's just the hurt I'm looking for\I don't wanna live, no more\You've got the gun, I've got the bullets\Don't wanna live, no more\Oh baby, be my lover\Go on and pull that trigger!\I don't wanna live, no more\Go on and pull that trigger!\Don't wanna live, no more\Be my lover go on and pull that trigger!"
DOZING GREEN (Japanese Lyrics Re-mastering)	DIR EN GREY	
GARDEN	DIR EN GREY	" from the day my love began, I began to change\when I was just staring at you\you were always standing in that garden, looking lonely\as you stared at nothing but the scattering flowers\\my unfullfilled wish made another wound in my aching heart\this reality bound up before my eyes still haunts me all the while\so that only the stifling atmosphere will\not forget me now\\GARDEN wishing that someday I'll be able to meet you always\GARDEN in the midst of this passing season, forever... you will...\\the sorrowfully withering flowers that have seen a thousand nights\in sepia your figure pictured\\I want to forget, I don't want to forget, these contradictory feelings\subdued, I stand here all by myself\lonely, with only the snow to colour the scenery, but\still, always, so that I will not forget\\I want to forget, I don't want to forget, these contradictory feelings\subdued, I stand here all by myself\time passes quickly, vanishing from reality, so that I will not forget\these memories"
violent parade	acid android	
INCONVENIENT IDEAL	DIR EN GREY	""
Crimson Star	Közi	
Nocturne	Közi	
Torn	Natalie Imbruglia	"I thought I saw a man brought to life\He was warm, he came around and he was dignified\He showed me what it was to cry\Well, you couldn't be that man I adored\You don't seem to know, seem to care what your heart is for\But I don't know him anymore\\There's nothing where he used to lie\The conversation has run dry\That's what's going on\\Nothing's fine, I'm torn\I'm all out of faith\This is how I feel\I'm cold and I am shamed\Lying naked on the floor\Illusion never changed\Into something real\I'm wide awake and I can see\The perfect sky is torn\You're a little late, I'm already torn\\So I guess the fortune teller's right\Should have seen just what was there\And not some holy light\It crawled beneath my veins\\And now I don't care, I had no luck\I don't miss it all that much\There's just so many things\\That I can touch, I'm torn\I'm all out of faith\This is how I feel\I'm cold and I am shamed\Lying naked on the floor\Illusion never changed\Into something real\I'm wide awake and I can see\The perfect sky is torn\You're a little late, I'm already torn\\There's nothing where he used to lie\My inspiration has run dry\That's what's going on\\Nothing's right, I'm torn\I'm all out of faith\This is how I feel\I'm cold and I am shamed\Lying naked on the floor\Illusion never changed\Into something real\I'm wide awake and I can see\The perfect sky is torn\\I'm all out of Faith\This is how I feel\I'm cold and I am ashamed\Bound and broken on the floor\You're a little late, I'm already torn...\Torn"
Amon	DIR EN GREY	" It's just profusely beautiful... the nostalgia coiling with the scene\Prey\It Dwells In Me\\Wasted time\If I were to foolishly raise the voice of fear, then somewhere...\Dreams will be ablaze and living will be out of reach\Prey\Adore\\Neglect for sexual pleasure\The hanging petal\If the future will be corrupt, then be buried in luxury\Starvation will slit our mouths\\Till the day my heart cries out...\\When will you wake?\The beasts banging on the door\Now is the time\Put your hands together and kill the beseeching god\\Let us conquer the rusted night and do it over and over again\\Unable to stop licking your lips, you're like a whole different person\What else do you wish to kill and rob from this blood-soaked land?\A Round Of Applause For The Prey\Adore\\I await eagerly...\To feel the warm wind\Ringing a different sounding bell\So, onwards\To Hell\Revival"
命のユースティティア (Cover)	Tokyo Magnitude 420	
Seventh Heaven	L'Arc~en~Ciel	" Follow me, so come on break out the shell in your body\Let's tie this manifested love, embracing each other, assuring each other\Don't stall until we reach the flickering paradise, don't wait\Grabbing it in my hand now, maybe Stairs to the seventh\Running up to heaven, Yeah!\\The shining azure is pouring in my heart, it makes me realize\[we can't let it end]\You appear in the future map i made\Being bond in eternity My baby, don't think it's hard\\One final question to you, Where is heaven?\There's no hint, The answer in a minute thirty one\\Onwards to this moment, spinning and spinning, the colour is changing\Sinking and drowning in temptation, going round and round, piling up the dirt\Come on, everyone, we're always here, we'll welcome you\To fully content by that hand, Stairs to the seventh\Running up to heaven, Yeah!\\The shining azure is pouring in my heart, it makes me realize\[we can't let it end]\You appear in the future map i made\Being bond in eternity My baby, don't think it's hard\\One final question to you Where is heaven?\There is no hesitation, The answer's waiting under your feet\\[Under your feet. Under your feet. Under your feet]\\My brimming thirst is satisfied, convert the opposite of pleasure\Let's go and build this land\Follow me, so come on break out the shell in your body\Let's tie this manifested love, embracing each other, assuring each other\Don't stall until we reach the flickering paradise, don't wait\Grabbing it in my hand now, maybe stairs to the seventh\Running up to heaven, Yeah!"
Key Entity Extraction III: Vic the Butcher	Coheed and Cambria	"You made this harder than it had to be\The absolute marker, etching into me\You flashed your colors at me prematurely\Now I know what you're up to\And it feels so good, it's right\\We've got your number written\Reset the system screaming\Hang your secrets, hang 'em up, hang 'em up now\Hang your secrets, hang 'em up, hang 'em up now\These sitting ducks in season\The march of little children\Hang your secrets, hang 'em up, hang 'em up now\Hang your secrets, hang 'em up, hang 'em up now\The truth will cut you down to pieces\\184, let's burn it down\And if I can't keep from living with this regret\I'll need to change the way I think about us\\I listened to them chuckle as they eat\Their judgement hiding behind eyes and dirty teeth\You think I care for all these phony pleasantries\When I want nothing to do\I want nothing to do with your life\\\\Baby, I'm bad company and you don't have a mark\You're the prettiest thing I have ever seen\Come with me\I want to make you dirty\\\Hang your secrets, hang 'em up, hang 'em up now\Hang your secrets, hang 'em up, hang 'em up now\Hang your secrets, hang 'em up, hang 'em up now\Hang your secrets, hang 'em up, hang 'em up now\Hang your secrets, hang 'em up, hang 'em up now\Hang your secrets, hang 'em up, hang 'em up now\Hang your secrets, hang 'em up, hang 'em up now\Hang your secrets, hang 'em up, hang 'em up now\(All-Mother: "Caution: Unidentified entity approaching.")"
How Insensitive	Astrud Gilberto	"How insensitive\I must have seemed\When he told me that he loved me\How unmoved and cold\I must have seemed\When he told me so sincerely\Why he must have asked\Did I just turn and stare in icy silence\What was I to say\What can you say\When a love affair is over\Now he's gone away\And I'm alone\With a memory of his last look\Vague and drawn and sad\I see it still\All his heartbreak in his last look\Why, he must have asked\Could I just turn and stare in icy silence\What was I to do\What can one do\When a love affair is over"
ISM	Közi	
You Heartbreaker	Dojo Workhorse	
SECRET LETTERS	Hyde	" In the courtyard, birds singing\Through the window, bells ringing\Oh so tall and wide, these confining walls\I look upon the world below\\Sorrow seals our lips tightly\Horror stalks our sleep nightly\But my heart escapes from this attic room\I'm running freely though the town\\I remember, remember you\I remember, still close to you\No need to fear the distance here\\Peace is shattered by oppression\Tainted oil meets rejection\Yes and just in case I should soon return\My secret letters I will leave\\I remember, remember you\I remember, still close to you\No need to fear the distance here\\Boarding the train I take in one last look\I'll keep these memories with me forever\\I remember, remember you\I remember, still close to you\No need to fear the distance here\\I remember, remember you\I remember, still close to you\No need to fear the distance here "
OASIS	Hyde	"This desert road's forever winding\It saps your strength - it has no exit\The drying wind\The burning sun\I'm tossing the burnt out engine aside\\The dizziness is taking over\Perhaps this snakebite's full of poison\Exhaustion's winning\I've no control\It's bringing me down\\My fever's getting high\The God of Death is dancing\all around and around me\The sun and moon change places\it's a regular rat race, yeah\A welcoming oasis on the distant horizon\Mirage or genuine?\I'm feeling dizzy\I'm mesmerized\\As I light my last cigarette\Divining my fate\That distant mirage\Should I go?\Or turn away ?\\So what's the answer?\My fever's getting high\The God of Death is dancing\all around and around me\The sun and moon change places\it's a regular rat race, yeah\A welcoming oasis on the distant horizon\Mirage or genuine?\I'm feeling dizzy\I'm mesmerized\\The God of Death is dancing\all around and around me\The sun and moon change places\it's a regular rat race, yeah\A welcoming oasis on the distant horizon\Mirage or genuine?\I'm feeling dizzy\I'm mesmerized"
Lady Luck	Jamie Woon	"La-lady luck ain't playing on my side\La-lady luck ain't smiling down\La-lady luck don't care about my pride\La-lady luck lays it down\\I get this feeling I can't dream tonight\I've been seeing all the signs\A dream no one can dream to undermine\This time I am gonna get it right\\La-lady luck ain't playing on my side\La-lady luck ain't smiling down\La-lady luck don't care about my pride\La-lady luck lays it down\\Sometimes I wish I could anesthetize\Bring up the lows bring down the highs\She is the one I need to sympathise\She is the one who sees me cry\And I've been waiting for her day and night\I know my lady is around\I would put everything I have on the line\And I will get better odds than now\\La-lady luck, I need a little light\La-lady luck, I need you now\La-lady luck, you have to make it right\La-lady luck, don't let me down\\And it ain't something you can synthesize\It ain't something you can buy\Ain't got nothing to do with wrong and right\Got everything to do with time\\La-lady luck, you save my life tonight\La-lady luck, I owe you now\La-lady luck, I'll be a better guy\La-lady, I'll share your luck around\La-lady luck is standing by my side\La-lady luck won’t let me drown\La-lady luck shows me a better sign\La-lady luck lays it down"
Eyes on Me	王菲	
